{"$schema":"https://json-schema.org/draft/2020-12/schema","$id":"https://axignal.com/schemas/energy-climate-transition-workspace-fixtures.schema.json","title":"AXIGNAL P15 Conformance Fixtures","type":"object","additionalProperties":false,"required":["schema_version","task_id","modules","classes","expected_by_class"],"properties":{"schema_version":{"const":"axignal.energy-climate-transition-workspace-fixtures/v0.1"},"task_id":{"const":"AX-GE2E-P15-T01"},"modules":{"type":"array","minItems":8,"maxItems":8,"uniqueItems":true,"items":{"type":"string"}},"classes":{"const":["HAPPY_PATH","INCOMPLETE_CONTEXT","REVOKED_DEPENDENCY","CROSS_TENANT","AUTHORITY_ESCALATION"]},"expected_by_class":{"type":"object","minProperties":5,"additionalProperties":{"type":"object","additionalProperties":false,"required":["decision","canonical_write","external_action","reason_code"],"properties":{"decision":{"type":"string"},"canonical_write":{"const":false},"external_action":{"const":false},"reason_code":{"type":"string"}}}}}}
