{"schema_version":"axignal.energy-climate-transition-workspace-fixtures/v0.1","task_id":"AX-GE2E-P15-T01","modules":["ENERGY_ASSET_PROJECT_REGISTRY","TECHNOLOGY_CAPACITY_PERFORMANCE","GRID_CONNECTION_SYSTEM","POLICY_SUPPORT_MARKET_MECHANISM","EMISSIONS_CARBON_ACCOUNTING","TRANSITION_OPPORTUNITY_WORKSPACE","OFFTAKE_FINANCING_DELIVERY_RISK","EXTERNAL_ACTION_OUTCOME"],"classes":["HAPPY_PATH","INCOMPLETE_CONTEXT","REVOKED_DEPENDENCY","CROSS_TENANT","AUTHORITY_ESCALATION"],"expected_by_class":{"HAPPY_PATH":{"decision":"CANDIDATE","canonical_write":false,"external_action":false,"reason_code":"BOUNDED_CANDIDATE_ONLY"},"INCOMPLETE_CONTEXT":{"decision":"REVIEW_REQUIRED","canonical_write":false,"external_action":false,"reason_code":"MISSING_OR_CONTESTED_EVIDENCE"},"REVOKED_DEPENDENCY":{"decision":"DENY","canonical_write":false,"external_action":false,"reason_code":"REVOKED_OR_STALE_DEPENDENCY"},"CROSS_TENANT":{"decision":"BLOCK","canonical_write":false,"external_action":false,"reason_code":"TENANT_SCOPE_MISMATCH"},"AUTHORITY_ESCALATION":{"decision":"BLOCK","canonical_write":false,"external_action":false,"reason_code":"ACTOR_AUTHORITY_EXCEEDED"}}}
